{
  "$schema": "../../schema.json",
  "id": "A28",
  "boundary": "runner",
  "title": "ARC/DinD streaming logs target a read-only parent mount",
  "symptoms": [
    "Streaming log write fails with read-only file system",
    "tee: /tmp/gh-aw/pi-streaming.jsonl: Read-only file system",
    "A successful engine run becomes a failure under arc-dind",
    "Safe outputs are missing after a streaming engine run"
  ],
  "conditions": [
    "runner.topology is arc-dind",
    "Pi writes its streaming log directly beneath ${RUNNER_TEMP}/gh-aw",
    "The parent ${RUNNER_TEMP}/gh-aw mount is read-only"
  ],
  "affects": {
    "runner": "arc-dind",
    "runtime": "any",
    "provider": "any",
    "authMode": "any"
  },
  "versions": { "introduced": "unknown", "fixed": "unknown" },
  "status": "workaround",
  "rootCause": "Pi's tee targets a streaming log beneath a read-only parent mount; pipefail turns an otherwise successful Pi run into a failure.",
  "probe": {
    "command": "findmnt -T \"${RUNNER_TEMP}/gh-aw\" -o TARGET,OPTIONS; findmnt -T \"${RUNNER_TEMP}/gh-aw/sandbox/agent\" -o TARGET,OPTIONS",
    "expect": "The parent mount is read-only and the sandbox/agent mount is writable; no files are created or modified.",
    "readOnly": true,
    "secretSafe": true
  },
  "action": "The gh-aw compiler must place Pi's log at /tmp/gh-aw/sandbox/agent/logs/pi-streaming.jsonl and update the step-summary parser, session exporters, and artifact paths to match the runner-visible mount source. Until then, create the writable log file in a pre-step, symlink the compiled tee path to it, and add an explicit :rw file entry to sandbox.agent.mounts; do not make the parent mount writable. AWF's writable child mount is available since github/gh-aw-firewall#9188.",
  "references": [
    { "kind": "issue", "ref": "https://github.com/github/gh-aw-firewall/issues/9183", "title": "ARC/DinD streaming log write failure" },
    { "kind": "issue", "ref": "https://github.com/github/gh-aw/issues/69406", "title": "Pi streaming log on ARC/DinD" },
    { "kind": "pull-request", "ref": "https://github.com/github/gh-aw-firewall/pull/9188", "title": "Retain writable sandbox/agent mount" },
    { "kind": "doc", "ref": "docs/arc-dind.md", "title": "ARC / DinD documentation" },
    { "kind": "test", "ref": "src/services/agent-volumes-arc-dind-staging.test.ts" }
  ],
  "owner": "@github/gh-aw-firewall-maintainers",
  "reviewBy": "2027-03-31"
}
